{"$schema":"https://json-schema.org/draft/2020-12/schema","$id":"https://prii.dev/schemas/federation-executability-graph.schema.json","title":"Federation Executability Inventory Graph","type":"object","required":["schema_version","generated_at","graph_type","nodes","edges","coverage","evidence_basis"],"properties":{"schema_version":{"const":"0.1.0"},"generated_at":{"type":"string","format":"date-time"},"graph_type":{"const":"federation-static-inventory"},"nodes":{"type":"array","items":{"type":"object","required":["node_id","kind","repository","label","attributes"],"properties":{"node_id":{"type":"string","minLength":12},"kind":{"enum":["repository","entry-point","framework","workflow-engine","authentication","destructive-boundary","gap"]},"repository":{"type":"string"},"label":{"type":"string"},"attributes":{"type":"object"}},"additionalProperties":false}},"edges":{"type":"array","items":{"type":"object","required":["edge_id","source","target","relation","confidence"],"properties":{"edge_id":{"type":"string","minLength":12},"source":{"type":"string"},"target":{"type":"string"},"relation":{"enum":["HAS_ENTRY_POINT","USES_FRAMEWORK","USES_WORKFLOW_ENGINE","DECLARES_AUTH_MODEL","HAS_DESTRUCTIVE_BOUNDARY","HAS_GAP"]},"confidence":{"type":"number","minimum":0,"maximum":1}},"additionalProperties":false}},"coverage":{"type":"object","required":["repositories","entry_points","frameworks","workflow_engines","destructive_boundaries","gaps"],"properties":{"repositories":{"type":"integer","minimum":0},"entry_points":{"type":"integer","minimum":0},"frameworks":{"type":"integer","minimum":0},"workflow_engines":{"type":"integer","minimum":0},"destructive_boundaries":{"type":"integer","minimum":0},"gaps":{"type":"integer","minimum":0}},"additionalProperties":false},"evidence_basis":{"type":"object","required":["manifest","repository_commits_pinned","runtime_execution"],"properties":{"manifest":{"type":"string"},"repository_commits_pinned":{"type":"boolean"},"runtime_execution":{"type":"boolean"}},"additionalProperties":false}},"additionalProperties":false}
