{"schema_version":"0.1.0","generated_at":"2026-08-06T23:04:00+00:00","graph_type":"federation-static-inventory","nodes":[{"node_id":"d5e64bbcf1ca","kind":"repository","repository":"Jotaele44/thehub-pr","label":"Jotaele44/thehub-pr","attributes":{"commit":"a5bad05ce5eec4cc73e2eed8569d294bc3f5cd27","manifest_id":"thehub-pr"}},{"node_id":"a7948591f129","kind":"entry-point","repository":"Jotaele44/thehub-pr","label":"entry-point inventory","attributes":{"count":4}},{"node_id":"4098e38adb62","kind":"framework","repository":"Jotaele44/thehub-pr","label":"framework inventory","attributes":{"count":4}},{"node_id":"5928c91e51f0","kind":"workflow-engine","repository":"Jotaele44/thehub-pr","label":"workflow inventory","attributes":{"count":1}},{"node_id":"8fe6a9e60c88","kind":"destructive-boundary","repository":"Jotaele44/thehub-pr","label":"destructive-boundary inventory","attributes":{"count":5}},{"node_id":"abb4b4990a62","kind":"gap","repository":"Jotaele44/thehub-pr","label":"known-gap inventory","attributes":{"count":2}},{"node_id":"c2e5d40267c4","kind":"repository","repository":"Jotaele44/spiderweb-pr","label":"Jotaele44/spiderweb-pr","attributes":{"commit":"3c5dd01dbbdfce5dcf12ee95b6623f440488d820","manifest_id":"spiderweb-pr"}},{"node_id":"877694ca17a1","kind":"entry-point","repository":"Jotaele44/spiderweb-pr","label":"entry-point inventory","attributes":{"count":5}},{"node_id":"f30c5c2c2cbe","kind":"framework","repository":"Jotaele44/spiderweb-pr","label":"framework inventory","attributes":{"count":4}},{"node_id":"57fa5af77364","kind":"workflow-engine","repository":"Jotaele44/spiderweb-pr","label":"workflow inventory","attributes":{"count":1}},{"node_id":"c78f4ad2692f","kind":"destructive-boundary","repository":"Jotaele44/spiderweb-pr","label":"destructive-boundary inventory","attributes":{"count":4}},{"node_id":"b6cefe5f4309","kind":"gap","repository":"Jotaele44/spiderweb-pr","label":"known-gap inventory","attributes":{"count":2}},{"node_id":"668756d465ee","kind":"repository","repository":"Jotaele44/skywatcher-pr","label":"Jotaele44/skywatcher-pr","attributes":{"commit":"f940dc1d4afae7740eaa2a94dbf4684d11ae156b","manifest_id":"skywatcher-pr"}},{"node_id":"fd0e1c70b120","kind":"entry-point","repository":"Jotaele44/skywatcher-pr","label":"entry-point inventory","attributes":{"count":4}},{"node_id":"7b1590bbc78c","kind":"framework","repository":"Jotaele44/skywatcher-pr","label":"framework inventory","attributes":{"count":4}},{"node_id":"fae499046ae7","kind":"workflow-engine","repository":"Jotaele44/skywatcher-pr","label":"workflow inventory","attributes":{"count":1}},{"node_id":"659b0dc5cad7","kind":"destructive-boundary","repository":"Jotaele44/skywatcher-pr","label":"destructive-boundary inventory","attributes":{"count":3}},{"node_id":"86698ebe3e95","kind":"gap","repository":"Jotaele44/skywatcher-pr","label":"known-gap inventory","attributes":{"count":2}},{"node_id":"5265291b2729","kind":"repository","repository":"Jotaele44/ovnis-pr","label":"Jotaele44/ovnis-pr","attributes":{"commit":"400994dcc4e0e752c6ead984b0956f65adb0e153","manifest_id":"ovnis-pr"}},{"node_id":"da8c02f13728","kind":"entry-point","repository":"Jotaele44/ovnis-pr","label":"entry-point inventory","attributes":{"count":2}},{"node_id":"b3f6ffec9334","kind":"framework","repository":"Jotaele44/ovnis-pr","label":"framework inventory","attributes":{"count":3}},{"node_id":"1d73c55be6fd","kind":"workflow-engine","repository":"Jotaele44/ovnis-pr","label":"workflow inventory","attributes":{"count":1}},{"node_id":"439a7426c514","kind":"destructive-boundary","repository":"Jotaele44/ovnis-pr","label":"destructive-boundary inventory","attributes":{"count":3}},{"node_id":"3ced1a6dfdb3","kind":"gap","repository":"Jotaele44/ovnis-pr","label":"known-gap inventory","attributes":{"count":2}},{"node_id":"e0a58fb369cf","kind":"repository","repository":"Jotaele44/aguayluz-pr","label":"Jotaele44/aguayluz-pr","attributes":{"commit":"0e10312ab35ea0d745963d7b3b48b39fb8aaf7ef","manifest_id":"aguayluz-pr"}},{"node_id":"3c55d8416a0f","kind":"entry-point","repository":"Jotaele44/aguayluz-pr","label":"entry-point inventory","attributes":{"count":3}},{"node_id":"fbc66b117d9d","kind":"framework","repository":"Jotaele44/aguayluz-pr","label":"framework inventory","attributes":{"count":4}},{"node_id":"da5d2035b422","kind":"workflow-engine","repository":"Jotaele44/aguayluz-pr","label":"workflow inventory","attributes":{"count":2}},{"node_id":"c48064afc18c","kind":"destructive-boundary","repository":"Jotaele44/aguayluz-pr","label":"destructive-boundary inventory","attributes":{"count":4}},{"node_id":"4006f0bed905","kind":"gap","repository":"Jotaele44/aguayluz-pr","label":"known-gap inventory","attributes":{"count":2}},{"node_id":"fccbabbb5bcb","kind":"repository","repository":"Jotaele44/centinelas-pr","label":"Jotaele44/centinelas-pr","attributes":{"commit":"f766efb6ede23398114a85cebf52d6530fa13891","manifest_id":"centinelas-pr"}},{"node_id":"f417d0e119f0","kind":"entry-point","repository":"Jotaele44/centinelas-pr","label":"entry-point inventory","attributes":{"count":7}},{"node_id":"f4d2c5254dca","kind":"framework","repository":"Jotaele44/centinelas-pr","label":"framework inventory","attributes":{"count":5}},{"node_id":"f2c7b7b4a434","kind":"workflow-engine","repository":"Jotaele44/centinelas-pr","label":"workflow inventory","attributes":{"count":3}},{"node_id":"1c6b00b799fd","kind":"destructive-boundary","repository":"Jotaele44/centinelas-pr","label":"destructive-boundary inventory","attributes":{"count":5}},{"node_id":"112db8c58b07","kind":"gap","repository":"Jotaele44/centinelas-pr","label":"known-gap inventory","attributes":{"count":3}},{"node_id":"96c81b2c308a","kind":"repository","repository":"Jotaele44/moneysweep-pr","label":"Jotaele44/moneysweep-pr","attributes":{"commit":"ab30e34e6307c6bb2782a1573e8d5ec7923af544","manifest_id":"moneysweep-pr"}},{"node_id":"98f9198c59f2","kind":"entry-point","repository":"Jotaele44/moneysweep-pr","label":"entry-point inventory","attributes":{"count":6}},{"node_id":"3c72c1a19ff7","kind":"framework","repository":"Jotaele44/moneysweep-pr","label":"framework inventory","attributes":{"count":5}},{"node_id":"58fabe0cf548","kind":"workflow-engine","repository":"Jotaele44/moneysweep-pr","label":"workflow inventory","attributes":{"count":4}},{"node_id":"014269519f64","kind":"destructive-boundary","repository":"Jotaele44/moneysweep-pr","label":"destructive-boundary inventory","attributes":{"count":5}},{"node_id":"dc6571e975a7","kind":"gap","repository":"Jotaele44/moneysweep-pr","label":"known-gap inventory","attributes":{"count":3}}],"edges":[{"edge_id":"0fe54c898c8c","source":"d5e64bbcf1ca","target":"a7948591f129","relation":"HAS_ENTRY_POINT","confidence":0.91},{"edge_id":"8dc0b0d9e72d","source":"d5e64bbcf1ca","target":"4098e38adb62","relation":"USES_FRAMEWORK","confidence":0.91},{"edge_id":"cbdd793c8e14","source":"d5e64bbcf1ca","target":"5928c91e51f0","relation":"USES_WORKFLOW_ENGINE","confidence":0.91},{"edge_id":"32bf8365df82","source":"d5e64bbcf1ca","target":"8fe6a9e60c88","relation":"HAS_DESTRUCTIVE_BOUNDARY","confidence":0.91},{"edge_id":"499fe055b21c","source":"d5e64bbcf1ca","target":"abb4b4990a62","relation":"HAS_GAP","confidence":0.91},{"edge_id":"10f1a7c494bf","source":"c2e5d40267c4","target":"877694ca17a1","relation":"HAS_ENTRY_POINT","confidence":0.88},{"edge_id":"238cdfc55f8e","source":"c2e5d40267c4","target":"f30c5c2c2cbe","relation":"USES_FRAMEWORK","confidence":0.88},{"edge_id":"bcfbc05714a6","source":"c2e5d40267c4","target":"57fa5af77364","relation":"USES_WORKFLOW_ENGINE","confidence":0.88},{"edge_id":"2adf4fd107a1","source":"c2e5d40267c4","target":"c78f4ad2692f","relation":"HAS_DESTRUCTIVE_BOUNDARY","confidence":0.88},{"edge_id":"a373e51dee48","source":"c2e5d40267c4","target":"b6cefe5f4309","relation":"HAS_GAP","confidence":0.88},{"edge_id":"c21d3f33f5ac","source":"668756d465ee","target":"fd0e1c70b120","relation":"HAS_ENTRY_POINT","confidence":0.84},{"edge_id":"2994717b90b0","source":"668756d465ee","target":"7b1590bbc78c","relation":"USES_FRAMEWORK","confidence":0.84},{"edge_id":"ede6af1778a6","source":"668756d465ee","target":"fae499046ae7","relation":"USES_WORKFLOW_ENGINE","confidence":0.84},{"edge_id":"78cc8bb55276","source":"668756d465ee","target":"659b0dc5cad7","relation":"HAS_DESTRUCTIVE_BOUNDARY","confidence":0.84},{"edge_id":"327d090f3b22","source":"668756d465ee","target":"86698ebe3e95","relation":"HAS_GAP","confidence":0.84},{"edge_id":"8f233a02ef6a","source":"5265291b2729","target":"da8c02f13728","relation":"HAS_ENTRY_POINT","confidence":0.8},{"edge_id":"f675be33c378","source":"5265291b2729","target":"b3f6ffec9334","relation":"USES_FRAMEWORK","confidence":0.8},{"edge_id":"4bbe46951779","source":"5265291b2729","target":"1d73c55be6fd","relation":"USES_WORKFLOW_ENGINE","confidence":0.8},{"edge_id":"416646ce7425","source":"5265291b2729","target":"439a7426c514","relation":"HAS_DESTRUCTIVE_BOUNDARY","confidence":0.8},{"edge_id":"a54a9a39eacd","source":"5265291b2729","target":"3ced1a6dfdb3","relation":"HAS_GAP","confidence":0.8},{"edge_id":"c2f12b1034ca","source":"e0a58fb369cf","target":"3c55d8416a0f","relation":"HAS_ENTRY_POINT","confidence":0.76},{"edge_id":"3896dae3f7a5","source":"e0a58fb369cf","target":"fbc66b117d9d","relation":"USES_FRAMEWORK","confidence":0.76},{"edge_id":"915fff886848","source":"e0a58fb369cf","target":"da5d2035b422","relation":"USES_WORKFLOW_ENGINE","confidence":0.76},{"edge_id":"10bcf0285558","source":"e0a58fb369cf","target":"c48064afc18c","relation":"HAS_DESTRUCTIVE_BOUNDARY","confidence":0.76},{"edge_id":"8e99c5d6b609","source":"e0a58fb369cf","target":"4006f0bed905","relation":"HAS_GAP","confidence":0.76},{"edge_id":"9b8a54797f44","source":"fccbabbb5bcb","target":"f417d0e119f0","relation":"HAS_ENTRY_POINT","confidence":0.93},{"edge_id":"4cf0402d39f7","source":"fccbabbb5bcb","target":"f4d2c5254dca","relation":"USES_FRAMEWORK","confidence":0.93},{"edge_id":"edc33c658274","source":"fccbabbb5bcb","target"